title,job_industry,date_posted,job_description,job_keyInfo
Software Engineer (Frontend),"View Jobs in ICT / Telecommunication
/
View Jobs at AJUA (Formerly mSurvey)","Posted: Jun 7, 2024","Never pay for any CBT, test or assessment as part of any recruitment process. When in doubt, contact us
AJUA (Formerly mSurvey) is Africa's first Integrated Customer Experience platform for businesses on the continent. We exist to bridge the gap between businesses and their customers. Ajua’s technology integrates with businesses at the points that matter most to their customers to measure and optimize their Customer Experience.

Read more about this company
 

Software Engineer (Frontend)


Job Type Full Time
Qualification BA/BSc/HND
Experience 3 years
Location Nairobi
Job Field ICT / Computer&nbsp



Requirements

Team player for a committed dev team.
3+ years of progressive software development experience (we product development preferred).
Experience with Java (or JVM languages), Python/PHP frameworks, and full-stack web development frameworks.
Strong understanding of front-end frameworks (React preferred).
Familiarity with emerging software paradigms and technologies.
Experience with APls and implementation.
Proficient in Unix/Linux, web services, and APIs.
Experience with Agile methodologies.
Secure software development practices understanding.
Optimizes code for functionality and efficiency.
Strong system design/documentation skills with an eye for detail (data & business requirements).








Method of Application 

Submit your CV to careeerseajua.com
 


Build your CV for free. Download in different templates.","Job Type Full Time
Qualification BA/BSc/HND
Experience 3 years
Location Nairobi
Job Field ICT / Computer&nbsp"
About Cigna,,,,
React Native Software Engineer,"View Jobs in Insurance
/
View Jobs at Cigna","Posted: Jun 6, 2024","Never pay for any CBT, test or assessment as part of any recruitment process. When in doubt, contact us
Cigna is a global health service company, dedicated to helping the people we serve improve their health, well-being and sense of security. Cigna has almost 40,000 employees who service over 80 million customer relationships around the world. Within its international division, a dedicated unit - headquartered in Belgium - focuses on the needs of International...

Read more about this company
 

React Native Software Engineer


Job Type Full Time
Qualification BA/BSc/HND
Experience 4 years
Location Nairobi
Job Field ICT / Computer&nbsp



Overview
Cigna International Health is initiating a project to develop a cutting-edge global mobile solution to bolster the expansion of our health businesses across the globe. We’re actively seeking accomplished leaders to champion our vision and steer us towards building a mobile platform for serving Cigna’s customers all over the world.
We are seeking an experienced Software Engineering to drive our front-end software development efforts in creating high-quality mobile solutions. The ideal candidate will engineer technical solutions, produce clean code, and ensure successful delivery of software solutions aligned with business goals.
Responsibilities
Technical Leadership:

Be responsible for the output of multiple disciplines within Application Development.
Implement software engineering strategy, ensuring that it aligns with the overall business and product objectives.
Contribute to the definition of applications development policies, standards, and procedures.

Project Delivery:

Execute software projects, ensuring they are delivered on time, within budget, and meet quality standards.
Develop solutions using TDD methodology.
Execute project plans and application designs to ensure projects are aligned with standards and IT strategy.
Architecture and Development: Guide the design principles, and development processes to ensure scalable, secure, and efficient solutions, collaborating with other senior leads.
Operational Efficiency: Implement DevSecOps to streamline processes, tools, and workflows to optimize engineering operations and enhance productivity.

Requirements

Experience: Proven experience (4 years) in a role within software development for commercial software products, with a strong technical background.
Technical Acumen: Knowledge of software development methodologies, source code management strategies, design patterns, DevSecOps, automation, and best practices. Ability to translate non-functional requirements such as availability, flexibility, stability, ease of maintenance and security.
Technologies covered: Experience of implementing software using ReactNative framework, TypeScript, web based and desktop clients, application servers, relational and non-relational databases, testing strategies.
Education: Bachelor’s or Master’s degree in Computer Science, Software Engineering, or a related field.
Global and regulatory landscapes: Experience of working practices across multiple geographies and with regional nuances such as tax rules, regulatory interfaces, multi-currency, multi-language etc is an advantage.
Aware of the concrete effects of architectural decisions – specifically microservice architecture – at the code level, in collaboration with other team members. 

Desirable


Experience of using Jira









Method of Application 

Interested and qualified? Go to Cigna on cigna.wd5.myworkdayjobs.com to apply


Build your CV for free. Download in different templates.","Job Type Full Time
Qualification BA/BSc/HND
Experience 4 years
Location Nairobi
Job Field ICT / Computer&nbsp"
About Cigna,,,,
React Native Senior Software Engineer,"View Jobs in Insurance
/
View Jobs at Cigna","Posted: Jun 6, 2024","Never pay for any CBT, test or assessment as part of any recruitment process. When in doubt, contact us
Cigna is a global health service company, dedicated to helping the people we serve improve their health, well-being and sense of security. Cigna has almost 40,000 employees who service over 80 million customer relationships around the world. Within its international division, a dedicated unit - headquartered in Belgium - focuses on the needs of International...

Read more about this company
 

React Native Senior Software Engineer


Job Type Full Time
Qualification BA/BSc/HND
Experience 7 years
Location Nairobi
Job Field ICT / Computer&nbsp



Responsibilities
Technical Leadership:

Provide direction and be responsible for the output of frontend discipline within Application Development.
Implement software engineering strategy, ensuring that it aligns with the overall business and product objectives.
Own the frontend application development capability for our global mobile solution aligned with the product vision as defined by the global mobile solution product owner.
Contribute to the definition of applications development policies, standards, and procedures.

Team Leadership:

Lead, mentor, and manage junior software development team members, fostering a culture of innovation, automation, collaboration, and excellence.
Responsible for career development and performance management of junior software development team members.

Project Delivery:

Execute software projects, ensuring they are delivered on time, within budget, and meet quality standards.
Develop solutions using TDD methodology.
Execute project plans and application designs to ensure projects are aligned with standards and IT strategy.
Allocate appropriate resources to ensure that projects are completed within committed time and budget and are integrated with other software applications.
Architecture and Development: Guide the design principles, and development processes to ensure scalable, secure, and efficient solutions, collaborating with other senior leads.
Operational Efficiency: Implement DevSecOps to streamline processes, tools, and workflows to optimize engineering operations and enhance productivity.

Requirements

Experience: Proven experience (7 years) in a senior role within software development for commercial software products, with a strong technical background.
Technical Acumen: Extensive knowledge of software development methodologies, source code management strategies, design patterns, DevSecOps, automation, and best practices. Ability to translate non-functional requirements such as availability, flexibility, stability, ease of maintenance and security.
Technologies covered: Experience of implementing software using ReactNative framework, TypeScript, web based and desktop clients, application servers, relational and non-relational databases, testing strategies.
Leadership Skills: Good leadership, mentoring, and communication skills to guide and inspire junior technical team members.
Education: Bachelor’s or Master’s degree in Computer Science, Software Engineering, or a related field.
Global and regulatory landscapes: Understanding and experience of working practices across multiple geographies. Experience with regional nuances such as tax rules, regulatory interfaces, multi-currency, multi-language etc is an advantage.
Aware of the concrete effects of architectural decisions – specifically microservice architecture – at the code level, in collaboration with other team members.

Desirable


Experience of using Jira









Method of Application 

Interested and qualified? Go to Cigna on cigna.wd5.myworkdayjobs.com to apply


Build your CV for free. Download in different templates.","Job Type Full Time
Qualification BA/BSc/HND
Experience 7 years
Location Nairobi
Job Field ICT / Computer&nbsp"
About Jumia,,,,
Frontend Software Engineer,"View Jobs in Internet / E-commerce
/
View Jobs at Jumia","Posted: Jun 4, 2024","Never pay for any CBT, test or assessment as part of any recruitment process. When in doubt, contact us
JUMIA is an e-commerce startup with an aim to mimic Amazon’s success by delivering a wide range of items, from toys to generators across the African continent. Shortly after the startup of the business in Nigeria, JUMIA launched warehouses in four other growing countries which include: Egypt, Morocco, Kenya and Cote d'Ivoire.

Read more about this company
 

Frontend Software Engineer


Job Type Full Time
Qualification BA/BSc/HND
Experience 1 year
Location Nairobi
Job Field ICT / Computer&nbsp



What you will be doing
Be part of an agile team that develops smart logistics solutions on a service-oriented architecture using state-of-the-art technologies
In particular, you will:

Work closely with a multidisciplinary team (Backend developers, DevOps, QA engineers, Product Owners) oriented to continuous delivery
Work across the entire product life cycle: concept, design, development, deployment, testing, release, support
Construct and verify (unit test) software components to meet design specifications
Take ownership for your code to be qualitatively high and you will support your colleagues in code reviews
Integration of user-facing elements developed by front-end developers
Rapidly fix bugs and solve problems

What we are looking for

Understanding fundamental design principles behind a scalable application
Write and test interactive, clean, secure and efficient solutions
Help maintain a high-level quality code by reviewing your teammates' code
Continuously improve our code base, systems and processes
Keen to learn new technologies and have ideas about how we can make things better
Being passionate, self-driven and working with little supervision towards a common team or company purpose
Excellent communication skills and being able to work independently or in a full team
A professional with 1+ years of frontend web experience
Proficient with at least one widely adopted single page application (SPA) architecture
Vanilla Javascript and modern frameworks and platforms such as AngularJS, Ember, ReactJS, VueJS and/or Node.js
Know module bundlers and task runners such as Webpack, Parcel, Rollup, Browserify, Grunt or Gulp
Semantic documents using HTML
Developing great user interfaces
Creating a testable code and make testing a priority
Agile methodologies such as Scrum and Kanban
Passionate for coaching other engineers and building a strong team culture








Method of Application 

Interested and qualified? Go to Jumia on boards.eu.greenhouse.io to apply


Build your CV for free. Download in different templates.","Job Type Full Time
Qualification BA/BSc/HND
Experience 1 year
Location Nairobi
Job Field ICT / Computer&nbsp"
